{
  "id": "bigmhc-el@1.0.0",
  "runtime": "Python",
  "script": "converters/bigmhc-el@1.0.0/converter.py",
  "sha256": "49f46ee9e3f76b530b095d3318b534bec14458dec0ca6df61d75984da05dbb68",
  "metadata": {
    "output_schema": "external-prediction-1.0.0",
    "description": "EL / BigMHC-EL; pinned schema; fixture-validated, predictor not executed",
    "usage": "python3 converter.py --input INPUT --output standard.tsv --bundle EXPORT",
    "arguments": [
      "--input",
      "--output",
      "--bundle"
    ],
    "license": "PolyForm-Noncommercial-1.0.0"
  },
  "supported_predictor_versions": [
    "git-199e890fa69a63646730bcecea0a520e08ca4f02; schema commit 199e890fa69a63646730bcecea0a520e08ca4f02"
  ],
  "source_revision": "https://github.com/KarchinLab/bigmhc/tree/199e890fa69a63646730bcecea0a520e08ca4f02"
}
